{
  "id": "fixture-profiler",
  "body": "EARTH",
  "frame": "ITRF93",
  "instrumentId": "atlas-tile-06",
  "missionId": "atlas-fixtures",
  "mode": "nominal",
  "passId": "pass-0",
  "segments": [
    {
      "etSec": 0,
      "left": [
        6370.970918226124,
        0,
        -19.24991212931296
      ],
      "right": [
        6370.970918226124,
        0,
        -19.24991212931296
      ],
      "sub": [
        {
          "kind": "beads",
          "points": [
            [
              6370.889549058161,
              -32.19944176419287,
              -19.249666272071824
            ],
            [
              6370.910266964095,
              -27.79960844790486,
              -19.249728871301027
            ],
            [
              6370.970538385181,
              -2.199989826471103,
              -19.24991098162215
            ],
            [
              6370.970538385181,
              2.199989826471103,
              -19.24991098162215
            ],
            [
              6370.910266964095,
              27.79960844790486,
              -19.249728871301027
            ],
            [
              6370.889549058161,
              32.19944176419287,
              -19.249666272071824
            ]
          ]
        }
      ],
      "state": "committed"
    },
    {
      "etSec": 0.13,
      "left": [
        6370.985162310507,
        0,
        -13.749967977047476
      ],
      "right": [
        6370.985162310507,
        0,
        -13.749967977047476
      ],
      "sub": [
        {
          "kind": "beads",
          "points": [
            [
              6370.903792596779,
              -32.19951375319672,
              -13.749792363554498
            ],
            [
              6370.924510641674,
              -27.799670600508325,
              -13.749837077589548
            ],
            [
              6370.984782467017,
              -2.1999947451620527,
              -13.74996715726283
            ],
            [
              6370.984782467017,
              2.1999947451620527,
              -13.74996715726283
            ],
            [
              6370.924510641674,
              27.799670600508325,
              -13.749837077589548
            ],
            [
              6370.903792596779,
              32.19951375319672,
              -13.749792363554498
            ]
          ]
        }
      ],
      "state": "committed"
    },
    {
      "etSec": 0.26,
      "left": [
        6370.99465841984,
        0,
        -8.249993083026789
      ],
      "right": [
        6370.99465841984,
        0,
        -8.249993083026789
      ],
      "sub": [
        {
          "kind": "beads",
          "points": [
            [
              6370.913288342265,
              -32.199561746134194,
              -8.249887714459847
            ],
            [
              6370.934006479801,
              -27.799712035808895,
              -8.249914543000841
            ],
            [
              6370.994278574651,
              -2.1999980243076807,
              -8.249992591153802
            ],
            [
              6370.994278574651,
              2.1999980243076807,
              -8.249992591153802
            ],
            [
              6370.934006479801,
              27.799712035808895,
              -8.249914543000841
            ],
            [
              6370.913288342265,
              32.199561746134194,
              -8.249887714459847
            ]
          ]
        }
      ],
      "state": "committed"
    },
    {
      "etSec": 0.39,
      "left": [
        6370.99940649043,
        0,
        -2.749999743815521
      ],
      "right": [
        6370.99940649043,
        0,
        -2.749999743815521
      ],
      "sub": [
        {
          "kind": "beads",
          "points": [
            [
              6370.918036230931,
              -32.19958574268341,
              -2.7499646208813466
            ],
            [
              6370.938754414787,
              -27.79973275352866,
              -2.7499735637483385
            ],
            [
              6370.999026644393,
              -2.1999996638859933,
              -2.7499995798574917
            ],
            [
              6370.999026644393,
              2.1999996638859933,
              -2.7499995798574917
            ],
            [
              6370.938754414787,
              27.79973275352866,
              -2.7499735637483385
            ],
            [
              6370.918036230931,
              32.19958574268341,
              -2.7499646208813466
            ]
          ]
        }
      ],
      "state": "committed"
    },
    {
      "etSec": 0.52,
      "left": [
        6370.99940649043,
        0,
        2.749999743815521
      ],
      "right": [
        6370.99940649043,
        0,
        2.749999743815521
      ],
      "sub": [
        {
          "kind": "beads",
          "points": [
            [
              6370.918036230931,
              -32.19958574268341,
              2.7499646208813466
            ],
            [
              6370.938754414787,
              -27.79973275352866,
              2.7499735637483385
            ],
            [
              6370.999026644393,
              -2.1999996638859933,
              2.7499995798574917
            ],
            [
              6370.999026644393,
              2.1999996638859933,
              2.7499995798574917
            ],
            [
              6370.938754414787,
              27.79973275352866,
              2.7499735637483385
            ],
            [
              6370.918036230931,
              32.19958574268341,
              2.7499646208813466
            ]
          ]
        }
      ],
      "state": "committed"
    },
    {
      "etSec": 0.65,
      "left": [
        6370.99465841984,
        0,
        8.249993083026789
      ],
      "right": [
        6370.99465841984,
        0,
        8.249993083026789
      ],
      "sub": [
        {
          "kind": "beads",
          "points": [
            [
              6370.913288342265,
              -32.199561746134194,
              8.249887714459847
            ],
            [
              6370.934006479801,
              -27.799712035808895,
              8.249914543000841
            ],
            [
              6370.994278574651,
              -2.1999980243076807,
              8.249992591153802
            ],
            [
              6370.994278574651,
              2.1999980243076807,
              8.249992591153802
            ],
            [
              6370.934006479801,
              27.799712035808895,
              8.249914543000841
            ],
            [
              6370.913288342265,
              32.199561746134194,
              8.249887714459847
            ]
          ]
        }
      ],
      "state": "committed"
    },
    {
      "etSec": 0.78,
      "left": [
        6370.985162310507,
        0,
        13.749967977047476
      ],
      "right": [
        6370.985162310507,
        0,
        13.749967977047476
      ],
      "sub": [
        {
          "kind": "beads",
          "points": [
            [
              6370.903792596779,
              -32.19951375319672,
              13.749792363554498
            ],
            [
              6370.924510641674,
              -27.799670600508325,
              13.749837077589548
            ],
            [
              6370.984782467017,
              -2.1999947451620527,
              13.74996715726283
            ],
            [
              6370.984782467017,
              2.1999947451620527,
              13.74996715726283
            ],
            [
              6370.924510641674,
              27.799670600508325,
              13.749837077589548
            ],
            [
              6370.903792596779,
              32.19951375319672,
              13.749792363554498
            ]
          ]
        }
      ],
      "state": "acquiring"
    },
    {
      "etSec": 0.91,
      "left": [
        6370.970918226124,
        0,
        19.24991212931296
      ],
      "right": [
        6370.970918226124,
        0,
        19.24991212931296
      ],
      "sub": [
        {
          "kind": "beads",
          "points": [
            [
              6370.889549058161,
              -32.19944176419287,
              19.249666272071824
            ],
            [
              6370.910266964095,
              -27.79960844790486,
              19.249728871301027
            ],
            [
              6370.970538385181,
              -2.199989826471103,
              19.24991098162215
            ],
            [
              6370.970538385181,
              2.199989826471103,
              19.24991098162215
            ],
            [
              6370.910266964095,
              27.79960844790486,
              19.249728871301027
            ],
            [
              6370.889549058161,
              32.19944176419287,
              19.249666272071824
            ]
          ]
        }
      ],
      "state": "planned"
    }
  ],
  "provenance": {
    "authority": "argelander-core@0.0.1",
    "generatedBy": "phase-0-authoring",
    "inputs": [
      "model:atlas-tile-06"
    ]
  }
}
