{
  "id": "fixture-pushbroom-0001",
  "body": "EARTH",
  "frame": "ITRF93",
  "instrumentId": "demo-pushbroom",
  "missionId": "fixtures",
  "mode": "nominal",
  "passId": "pass-1",
  "segments": [
    {
      "etSec": 0.0,
      "left": [
        6371.0,
        -0.9,
        0.0
      ],
      "right": [
        6371.0,
        0.9,
        0.0
      ],
      "state": "committed"
    },
    {
      "etSec": 1.0,
      "left": [
        6370.9,
        -0.9,
        0.9
      ],
      "right": [
        6370.9,
        0.9,
        0.9
      ],
      "state": "committed"
    },
    {
      "etSec": 2.0,
      "left": [
        6370.6,
        -0.9,
        1.8
      ],
      "right": [
        6370.6,
        0.9,
        1.8
      ],
      "state": "committed"
    },
    {
      "etSec": 3.0,
      "left": [
        6370.1,
        -0.9,
        2.7
      ],
      "right": [
        6370.1,
        0.9,
        2.7
      ],
      "state": "acquiring"
    },
    {
      "etSec": 4.0,
      "left": [
        6369.4,
        -0.9,
        3.6
      ],
      "right": [
        6369.4,
        0.9,
        3.6
      ],
      "state": "planned"
    }
  ],
  "provenance": {
    "authority": "argelander-core@0.0.1",
    "generatedBy": "seed-fixture",
    "inputs": []
  }
}
