{
  "id": "fixture-target-stare",
  "body": "MARS",
  "frame": "IAU_MARS",
  "instrumentId": "atlas-tile-18",
  "missionId": "atlas-fixtures",
  "mode": "targeted",
  "passId": "pass-0",
  "segments": [
    {
      "etSec": 3,
      "left": [
        3389.4286052945927,
        21.999536603180715,
        0
      ],
      "right": [
        3389.2870093091174,
        37.99761214153901,
        0
      ],
      "state": "committed",
      "sub": [
        {
          "kind": "frame",
          "corners": [
            [
              3389.3485216499275,
              29.031045469592982,
              13.566399242167984
            ],
            [
              3389.4568245339924,
              16.79465400900728,
              3.2594810424150156
            ],
            [
              3389.3313948760942,
              30.966116625977758,
              -13.566330689568549
            ],
            [
              3389.2231040147135,
              43.20160253211662,
              -3.2592562843958843
            ]
          ],
          "frameId": "stare-1"
        }
      ]
    },
    {
      "etSec": 4,
      "left": [
        3389.4286052945927,
        21.999536603180715,
        0
      ],
      "right": [
        3389.2870093091174,
        37.99761214153901,
        0
      ],
      "state": "committed",
      "sub": [
        {
          "kind": "frame",
          "corners": [
            [
              3389.306833692127,
              33.74118281408148,
              13.075537088640607
            ],
            [
              3389.439846925877,
              18.71281031518363,
              7.589782684270021
            ],
            [
              3389.373083740208,
              26.255911017465785,
              -13.075792673337808
            ],
            [
              3389.240078366043,
              41.283691528590616,
              -7.589335353730235
            ]
          ],
          "frameId": "stare-1"
        }
      ]
    },
    {
      "etSec": 5,
      "left": [
        3389.4286052945927,
        21.999536603180715,
        0
      ],
      "right": [
        3389.2870093091174,
        37.99761214153901,
        0
      ],
      "state": "committed",
      "sub": [
        {
          "kind": "frame",
          "corners": [
            [
              3389.269163574403,
              37.99741207134602,
              10.999250862758057
            ],
            [
              3389.4107573231454,
              21.99942075855117,
              10.999710379275585
            ],
            [
              3389.4107573231454,
              21.99942075855117,
              -10.999710379275585
            ],
            [
              3389.269163574403,
              37.99741207134602,
              -10.999250862758057
            ]
          ],
          "frameId": "stare-1"
        }
      ]
    },
    {
      "etSec": 6,
      "left": [
        3389.4286052945927,
        21.999536603180715,
        0
      ],
      "right": [
        3389.2870093091174,
        37.99761214153901,
        0
      ],
      "state": "acquiring",
      "sub": [
        {
          "kind": "frame",
          "corners": [
            [
              3389.240078366043,
              41.283691528590616,
              7.589335353730235
            ],
            [
              3389.373083740208,
              26.255911017465785,
              13.075792673337808
            ],
            [
              3389.439846925877,
              18.71281031518363,
              -7.589782684270021
            ],
            [
              3389.306833692127,
              33.74118281408148,
              -13.075537088640607
            ]
          ],
          "frameId": "stare-1"
        }
      ]
    },
    {
      "etSec": 7,
      "left": [
        3389.4286052945927,
        21.999536603180715,
        0
      ],
      "right": [
        3389.2870093091174,
        37.99761214153901,
        0
      ],
      "state": "planned",
      "sub": [
        {
          "kind": "frame",
          "corners": [
            [
              3389.2231040147135,
              43.20160253211662,
              3.2592562843958843
            ],
            [
              3389.3313948760942,
              30.966116625977758,
              13.566330689568549
            ],
            [
              3389.4568245339924,
              16.79465400900728,
              -3.2594810424150156
            ],
            [
              3389.3485216499275,
              29.031045469592982,
              -13.566399242167984
            ]
          ],
          "frameId": "stare-1"
        }
      ]
    }
  ],
  "provenance": {
    "authority": "argelander-core@0.0.1",
    "generatedBy": "phase-0-authoring",
    "inputs": [
      "model:atlas-tile-18"
    ]
  }
}
