{
  "id": "fixture-scansar-tops",
  "body": "EARTH",
  "frame": "ITRF93",
  "instrumentId": "atlas-tile-08",
  "missionId": "atlas-fixtures",
  "mode": "nominal",
  "passId": "pass-0",
  "segments": [
    {
      "etSec": 0,
      "left": [
        6370.8981785515225,
        31.199501360980616,
        -17.99971232364266
      ],
      "right": [
        6370.724946395897,
        56.39756505677737,
        -17.99922289046086
      ],
      "sub": [
        {
          "kind": "sub-swath",
          "index": 0,
          "burstId": "burst-00"
        }
      ],
      "state": "committed"
    },
    {
      "etSec": 0.55,
      "left": [
        6370.703187436,
        59.997204716082244,
        -13.499371061118506
      ],
      "right": [
        6370.416083268032,
        85.19219122499393,
        -13.49876269410115
      ],
      "sub": [
        {
          "kind": "sub-swath",
          "index": 1,
          "burstId": "burst-01"
        }
      ],
      "state": "committed"
    },
    {
      "etSec": 1.1,
      "left": [
        6370.374880903708,
        88.79128699172017,
        -8.999116924836505
      ],
      "right": [
        6369.973956911911,
        113.98164041562673,
        -8.998550559128425
      ],
      "sub": [
        {
          "kind": "sub-swath",
          "index": 2,
          "burstId": "burst-02"
        }
      ],
      "state": "committed"
    },
    {
      "etSec": 1.6500000000000001,
      "left": [
        6370.922016029257,
        31.199618097647594,
        -4.499944917929941
      ],
      "right": [
        6370.748781929172,
        56.397776063538736,
        -4.499822558261069
      ],
      "sub": [
        {
          "kind": "sub-swath",
          "index": 0,
          "burstId": "burst-03"
        }
      ],
      "state": "committed"
    },
    {
      "etSec": 2.2,
      "left": [
        6370.717488577324,
        59.9973393995667,
        0
      ],
      "right": [
        6370.43038247594,
        85.1923824496861,
        0
      ],
      "sub": [
        {
          "kind": "sub-swath",
          "index": 1,
          "burstId": "burst-04"
        }
      ],
      "state": "committed"
    },
    {
      "etSec": 2.75,
      "left": [
        6370.379647203162,
        88.79135342515158,
        4.499561828977276
      ],
      "right": [
        6369.978722311511,
        113.98172568568705,
        4.499278645487647
      ],
      "sub": [
        {
          "kind": "sub-swath",
          "index": 2,
          "burstId": "burst-05"
        }
      ],
      "state": "committed"
    },
    {
      "etSec": 3.3000000000000003,
      "left": [
        6370.9172485123045,
        31.199594750209368,
        8.999883101021933
      ],
      "right": [
        6370.744014801114,
        56.39773386199698,
        8.999638382233561
      ],
      "sub": [
        {
          "kind": "sub-swath",
          "index": 0,
          "burstId": "burst-06"
        }
      ],
      "state": "committed"
    },
    {
      "etSec": 3.8500000000000005,
      "left": [
        6370.703187436,
        59.997204716082244,
        13.499371061118506
      ],
      "right": [
        6370.416083268032,
        85.19219122499393,
        13.49876269410115
      ],
      "sub": [
        {
          "kind": "sub-swath",
          "index": 1,
          "burstId": "burst-07"
        }
      ],
      "state": "acquiring"
    },
    {
      "etSec": 4.4,
      "left": [
        6370.355815812875,
        88.79102125948569,
        17.998179985030884
      ],
      "right": [
        6369.9548954204665,
        113.98129933729919,
        17.997047263784083
      ],
      "sub": [
        {
          "kind": "sub-swath",
          "index": 2,
          "burstId": "burst-08"
        }
      ],
      "state": "planned"
    }
  ],
  "provenance": {
    "authority": "argelander-core@0.0.1",
    "generatedBy": "phase-0-authoring",
    "inputs": [
      "model:atlas-tile-08"
    ]
  }
}
