{
  "id": "conformance-spotlight-sar",
  "body": "EARTH",
  "frame": "ITRF93",
  "instrumentId": "atlas-tile-09",
  "missionId": "conformance",
  "mode": "dwell",
  "passId": "pass-0",
  "segments": [
    {
      "etSec": 2.15,
      "left": [
        6370.226318948196,
        -66.90189703902189,
        73.36062671688319
      ],
      "right": [
        6370.0568693308105,
        -84.53870431899686,
        69.78315673158825
      ],
      "state": "committed",
      "sub": [
        {
          "kind": "frame",
          "corners": [
            [
              6370.3754457978985,
              -64.51966494988402,
              61.602698073833004
            ],
            [
              6370.205984280115,
              -82.156948414418,
              58.02545707731561
            ],
            [
              6369.885174178304,
              -86.92004050841537,
              81.54001681055745
            ],
            [
              6370.054610093926,
              -69.28377190872673,
              85.11770304233566
            ]
          ],
          "frameId": "patch-1"
        }
      ]
    },
    {
      "etSec": 2.5749999999999997,
      "left": [
        6370.226318948196,
        -66.90189703902189,
        73.36062671688319
      ],
      "right": [
        6370.0568693308105,
        -84.53870431899686,
        69.78315673158825
      ],
      "state": "committed",
      "sub": [
        {
          "kind": "frame",
          "corners": [
            [
              6370.3754457978985,
              -64.51966494988402,
              61.602698073833004
            ],
            [
              6370.205984280115,
              -82.156948414418,
              58.02545707731561
            ],
            [
              6369.885174178304,
              -86.92004050841537,
              81.54001681055745
            ],
            [
              6370.054610093926,
              -69.28377190872673,
              85.11770304233566
            ]
          ],
          "frameId": "patch-1"
        }
      ]
    },
    {
      "etSec": 3,
      "left": [
        6370.226318948196,
        -66.90189703902189,
        73.36062671688319
      ],
      "right": [
        6370.0568693308105,
        -84.53870431899686,
        69.78315673158825
      ],
      "state": "committed",
      "sub": [
        {
          "kind": "frame",
          "corners": [
            [
              6370.3754457978985,
              -64.51966494988402,
              61.602698073833004
            ],
            [
              6370.205984280115,
              -82.156948414418,
              58.02545707731561
            ],
            [
              6369.885174178304,
              -86.92004050841537,
              81.54001681055745
            ],
            [
              6370.054610093926,
              -69.28377190872673,
              85.11770304233566
            ]
          ],
          "frameId": "patch-1"
        }
      ]
    },
    {
      "etSec": 3.425,
      "left": [
        6370.226318948196,
        -66.90189703902189,
        73.36062671688319
      ],
      "right": [
        6370.0568693308105,
        -84.53870431899686,
        69.78315673158825
      ],
      "state": "committed",
      "sub": [
        {
          "kind": "frame",
          "corners": [
            [
              6370.3754457978985,
              -64.51966494988402,
              61.602698073833004
            ],
            [
              6370.205984280115,
              -82.156948414418,
              58.02545707731561
            ],
            [
              6369.885174178304,
              -86.92004050841537,
              81.54001681055745
            ],
            [
              6370.054610093926,
              -69.28377190872673,
              85.11770304233566
            ]
          ],
          "frameId": "patch-1"
        }
      ]
    },
    {
      "etSec": 3.8499999999999996,
      "left": [
        6370.226318948196,
        -66.90189703902189,
        73.36062671688319
      ],
      "right": [
        6370.0568693308105,
        -84.53870431899686,
        69.78315673158825
      ],
      "state": "committed",
      "sub": [
        {
          "kind": "frame",
          "corners": [
            [
              6370.3754457978985,
              -64.51966494988402,
              61.602698073833004
            ],
            [
              6370.205984280115,
              -82.156948414418,
              58.02545707731561
            ],
            [
              6369.885174178304,
              -86.92004050841537,
              81.54001681055745
            ],
            [
              6370.054610093926,
              -69.28377190872673,
              85.11770304233566
            ]
          ],
          "frameId": "patch-1"
        }
      ]
    },
    {
      "etSec": 6.35,
      "left": [
        6370.165723592529,
        -23.520492775465065,
        -100.38147431908057
      ],
      "right": [
        6370.01887066688,
        -41.158432221535406,
        -103.95465744693692
      ],
      "state": "committed",
      "sub": [
        {
          "kind": "frame",
          "corners": [
            [
              6369.977979583077,
              -21.13615004142973,
              -112.1374281322706
            ],
            [
              6369.831139641067,
              -38.77362465878642,
              -115.71023502614536
            ],
            [
              6370.184024438041,
              -43.54322595617378,
              -92.19805999966836
            ],
            [
              6370.330888786498,
              -25.904884200821286,
              -88.62451324081377
            ]
          ],
          "frameId": "patch-2"
        }
      ]
    },
    {
      "etSec": 6.7749999999999995,
      "left": [
        6370.165723592529,
        -23.520492775465065,
        -100.38147431908057
      ],
      "right": [
        6370.01887066688,
        -41.158432221535406,
        -103.95465744693692
      ],
      "state": "acquiring",
      "sub": [
        {
          "kind": "frame",
          "corners": [
            [
              6369.977979583077,
              -21.13615004142973,
              -112.1374281322706
            ],
            [
              6369.831139641067,
              -38.77362465878642,
              -115.71023502614536
            ],
            [
              6370.184024438041,
              -43.54322595617378,
              -92.19805999966836
            ],
            [
              6370.330888786498,
              -25.904884200821286,
              -88.62451324081377
            ]
          ],
          "frameId": "patch-2"
        }
      ]
    },
    {
      "etSec": 7.199999999999999,
      "left": [
        6370.165723592529,
        -23.520492775465065,
        -100.38147431908057
      ],
      "right": [
        6370.01887066688,
        -41.158432221535406,
        -103.95465744693692
      ],
      "state": "planned",
      "sub": [
        {
          "kind": "frame",
          "corners": [
            [
              6369.977979583077,
              -21.13615004142973,
              -112.1374281322706
            ],
            [
              6369.831139641067,
              -38.77362465878642,
              -115.71023502614536
            ],
            [
              6370.184024438041,
              -43.54322595617378,
              -92.19805999966836
            ],
            [
              6370.330888786498,
              -25.904884200821286,
              -88.62451324081377
            ]
          ],
          "frameId": "patch-2"
        }
      ]
    },
    {
      "etSec": 7.625,
      "left": [
        6370.165723592529,
        -23.520492775465065,
        -100.38147431908057
      ],
      "right": [
        6370.01887066688,
        -41.158432221535406,
        -103.95465744693692
      ],
      "state": "planned",
      "sub": [
        {
          "kind": "frame",
          "corners": [
            [
              6369.977979583077,
              -21.13615004142973,
              -112.1374281322706
            ],
            [
              6369.831139641067,
              -38.77362465878642,
              -115.71023502614536
            ],
            [
              6370.184024438041,
              -43.54322595617378,
              -92.19805999966836
            ],
            [
              6370.330888786498,
              -25.904884200821286,
              -88.62451324081377
            ]
          ],
          "frameId": "patch-2"
        }
      ]
    },
    {
      "etSec": 8.049999999999999,
      "left": [
        6370.165723592529,
        -23.520492775465065,
        -100.38147431908057
      ],
      "right": [
        6370.01887066688,
        -41.158432221535406,
        -103.95465744693692
      ],
      "state": "planned",
      "sub": [
        {
          "kind": "frame",
          "corners": [
            [
              6369.977979583077,
              -21.13615004142973,
              -112.1374281322706
            ],
            [
              6369.831139641067,
              -38.77362465878642,
              -115.71023502614536
            ],
            [
              6370.184024438041,
              -43.54322595617378,
              -92.19805999966836
            ],
            [
              6370.330888786498,
              -25.904884200821286,
              -88.62451324081377
            ]
          ],
          "frameId": "patch-2"
        }
      ]
    }
  ],
  "provenance": {
    "authority": "argelander-core@0.0.1",
    "generatedBy": "conformance-sampler",
    "correction": "NONE",
    "inputs": [
      "model:atlas-tile-09",
      "scene:atlas-tile-09"
    ]
  }
}
