{
  "id": "conformance-agile-tasking",
  "body": "EARTH",
  "frame": "ITRF93",
  "instrumentId": "atlas-tile-14",
  "missionId": "conformance",
  "mode": "nominal",
  "passId": "pass-0",
  "segments": [
    {
      "etSec": 2,
      "left": [
        6369.196386967895,
        54.56803983580213,
        141.423877982507
      ],
      "right": [
        6369.196386967895,
        -105.33354513876168,
        109.01022201442017
      ],
      "state": "committed",
      "sub": [
        {
          "kind": "frame",
          "corners": [
            [
              6369.620539192035,
              40.297665207179094,
              126.29839619659762
            ],
            [
              6369.777529779282,
              22.660845014154702,
              122.72614726372285
            ],
            [
              6369.296429882165,
              17.892344488781415,
              146.23218626210453
            ],
            [
              6369.1394748631565,
              35.52795021413319,
              149.80358638381006
            ]
          ],
          "frameId": "point"
        }
      ]
    },
    {
      "etSec": 4,
      "left": [
        6370.335112730326,
        71.50265635494529,
        57.95620457979031
      ],
      "right": [
        6370.335112730326,
        -88.42751685009557,
        25.536753490488337
      ],
      "state": "committed",
      "sub": [
        {
          "kind": "frame",
          "corners": [
            [
              6370.973169394889,
              8.113342553094053,
              16.61470803373449
            ],
            [
              6370.964030310248,
              -5.261304421589063,
              20.751943734928478
            ],
            [
              6370.557367498519,
              11.287013214140003,
              74.24574562253903
            ],
            [
              6370.566504833208,
              24.660830209736094,
              70.10885072920202
            ]
          ],
          "frameId": "strip"
        }
      ]
    },
    {
      "etSec": 6,
      "left": [
        6370.335112730326,
        88.42751685009557,
        -25.536753490488337
      ],
      "right": [
        6370.335112730326,
        -71.50265635494529,
        -57.95620457979031
      ],
      "state": "acquiring",
      "sub": [
        {
          "kind": "frame",
          "corners": [
            [
              6370.730239624833,
              0.03742873065958331,
              -58.62774538392533
            ],
            [
              6370.7026493653,
              -19.957638301020907,
              -58.22753681369394
            ],
            [
              6370.888797146043,
              -19.438265191936555,
              -32.23489173824815
            ],
            [
              6370.916389824166,
              0.5573883345446209,
              -32.63499943417361
            ]
          ],
          "frameId": "stereo-fore"
        },
        {
          "kind": "frame",
          "corners": [
            [
              6370.7759240348705,
              4.731021807023746,
              -53.22352083721166
            ],
            [
              6370.689972782738,
              -13.529932168439995,
              -61.377614983015924
            ],
            [
              6370.843110307764,
              -24.131768103136285,
              -37.639362538627424
            ],
            [
              6370.929067758372,
              -5.870518209973438,
              -29.484752116673405
            ]
          ],
          "frameId": "stereo-aft"
        }
      ]
    },
    {
      "etSec": 8,
      "left": [
        6369.196386967895,
        105.33354513876168,
        -109.0102220144202
      ],
      "right": [
        6369.196386967895,
        -54.56803983580213,
        -141.42387798250704
      ],
      "state": "planned",
      "sub": [
        {
          "kind": "frame",
          "corners": [
            [
              6369.04671563649,
              -18.84485709273624,
              -156.61993934741292
            ],
            [
              6368.942089974497,
              -30.60154757817976,
              -159.00062841731585
            ],
            [
              6369.420976488646,
              -34.973490549225836,
              -137.45646301724767
            ],
            [
              6369.525625753497,
              -23.21598790715242,
              -135.07524116216518
            ]
          ],
          "frameId": "corridor-0"
        },
        {
          "kind": "frame",
          "corners": [
            [
              6368.406113127021,
              -22.07705631508704,
              -180.43608805015205
            ],
            [
              6368.404489562896,
              -33.9374697830541,
              -178.64351502331786
            ],
            [
              6368.9935901537665,
              -30.654005579477626,
              -156.91392711348115
            ],
            [
              6368.995214168491,
              -18.792494143101063,
              -158.70666042336507
            ]
          ],
          "frameId": "corridor-1"
        },
        {
          "kind": "frame",
          "corners": [
            [
              6367.7196376626525,
              -33.28339526118132,
              -201.69241861135416
            ],
            [
              6367.835341371098,
              -43.80975972940413,
              -195.94583470355113
            ],
            [
              6368.463171100696,
              -33.270917043712835,
              -176.6660250674944
            ],
            [
              6368.3474331664565,
              -22.743706228144912,
              -182.41352556542117
            ]
          ],
          "frameId": "corridor-2"
        }
      ]
    }
  ],
  "provenance": {
    "authority": "argelander-core@0.0.1",
    "generatedBy": "conformance-sampler",
    "correction": "NONE",
    "inputs": [
      "model:atlas-tile-14",
      "scene:atlas-tile-14"
    ]
  }
}
