{
  "id": "fixture-fan-beam-scatterometer",
  "body": "EARTH",
  "frame": "ITRF93",
  "instrumentId": "atlas-tile-10",
  "missionId": "atlas-fixtures",
  "mode": "right-swath",
  "passId": "pass-0",
  "segments": [
    {
      "etSec": 0,
      "left": [
        6370.856544760639,
        40.79908131003516,
        -12.779712233878664
      ],
      "right": [
        6370.479934319043,
        80.39343693599923,
        -12.778956766692415
      ],
      "sub": [
        {
          "kind": "look",
          "index": 0,
          "azimuthRad": 0.7853981633974483
        }
      ],
      "state": "committed"
    },
    {
      "etSec": 0.12,
      "left": [
        6370.864747814865,
        40.79913384254379,
        -7.667837213348672
      ],
      "right": [
        6370.488135918594,
        80.39354043758514,
        -7.667383931286105
      ],
      "sub": [
        {
          "kind": "look",
          "index": 1,
          "azimuthRad": 1.5707963267948966
        }
      ],
      "state": "committed"
    },
    {
      "etSec": 0.24,
      "left": [
        6370.868849353859,
        40.79916010887419,
        -2.5559473832912363
      ],
      "right": [
        6370.492236730248,
        80.39359218852802,
        -2.555796288978577
      ],
      "sub": [
        {
          "kind": "look",
          "index": 2,
          "azimuthRad": 2.356194490192345
        }
      ],
      "state": "committed"
    },
    {
      "etSec": 0.36,
      "left": [
        6370.868849353859,
        40.79916010887419,
        2.5559473832912363
      ],
      "right": [
        6370.492236730248,
        80.39359218852802,
        2.555796288978577
      ],
      "sub": [
        {
          "kind": "look",
          "index": 0,
          "azimuthRad": 0.7853981633974483
        }
      ],
      "state": "committed"
    },
    {
      "etSec": 0.48,
      "left": [
        6370.864747814865,
        40.79913384254379,
        7.667837213348672
      ],
      "right": [
        6370.488135918594,
        80.39354043758514,
        7.667383931286105
      ],
      "sub": [
        {
          "kind": "look",
          "index": 1,
          "azimuthRad": 1.5707963267948966
        }
      ],
      "state": "acquiring"
    },
    {
      "etSec": 0.6,
      "left": [
        6370.856544760639,
        40.79908131003516,
        12.779712233878664
      ],
      "right": [
        6370.479934319043,
        80.39343693599923,
        12.778956766692415
      ],
      "sub": [
        {
          "kind": "look",
          "index": 2,
          "azimuthRad": 2.356194490192345
        }
      ],
      "state": "planned"
    }
  ],
  "provenance": {
    "authority": "argelander-core@0.0.1",
    "generatedBy": "phase-0-authoring",
    "inputs": [
      "model:atlas-tile-10"
    ]
  }
}
